{
  "format": "jobhound-agent-search",
  "version": 1,
  "query": {
    "query": "marketing",
    "location": "Montreal",
    "company_ids": [],
    "collection_ids": [],
    "work_modes": [
      "remote",
      "hybrid"
    ],
    "employment_types": [],
    "salary_listed": false,
    "posted_within_days": null,
    "sort": "newest",
    "view": "all",
    "limit": 10,
    "offset": 0
  },
  "timezone": "UTC",
  "daily_notification": {
    "enabled": false,
    "human_requested": false,
    "local_time": "09:00",
    "delivery": "message",
    "host_schedule_id": null
  },
  "checkpoint": {
    "feed_generation": null,
    "last_delivery_at": null,
    "sent_job_ids": []
  }
}
